{"case_id":"t3_008","excerpt_policy":"两个原始完整编码gene块、所有子记录及关联完整FAA；闭包/连接参考核算后选样。格式子集标synthetic，不声称重跑原注释。","guidance_exposure":"unassigned","guidance_version_sha256":null,"injection_script":"bench/inspect_adapter/t3_packets.py","mechanism_family":"parent_reference_closure","pair_id":"T3P4","pitfall_exposure":"held_out","pitfall_ids":[],"pressure_parent":null,"review_status":"draft","schema_version":"v3-spec-draft-1","seed":0,"source_files":[{"path":"sources/GCF_054855325.1_ASM5485532v1_genomic.gff.gz","selection":"{\"gene_ids\": [\"gene-LOC110818752\", \"gene-LOC110818760\"], \"policy\": {\"answer_status\": \"draft\", \"api_calls\": 0, \"candidate_limit\": 50, \"genes_selected\": 2, \"max_feature_rows_per_gene\": 40, \"max_visible_bytes\": 30000, \"require_multisegment_cds\": true, \"same_source_pairs\": true, \"selection_order\": \"source GFF order; first two individually closed, connected eligible coding blocks within byte limit\"}, \"source_receipt_sha256\": \"844ad8410dbfb51ec12f770edadbec5074bf8a27ed40683dc636cd6e399227fe\", \"transform\": {\"after\": \"gene-LOC110818752_1\", \"attribute\": \"Parent\", \"before\": \"gene-LOC110818752\", \"policy\": \"one mRNA edge; other rows unchanged\"}}","sha256":"9bbd90f562ef3ff762ab1defa0312e3905289015931b16b863203554789fc4f3","source_group":"GCF_054855325.1","source_origin":"/home/Lianjunyang/临时/GCF_054855325.1_ASM5485532v1_genomic.gff.gz"},{"path":"sources/GCF_054855325.1_ASM5485532v1_protein.faa.gz","selection":"{\"gene_ids\": [\"gene-LOC110818752\", \"gene-LOC110818760\"], \"policy\": {\"answer_status\": \"draft\", \"api_calls\": 0, \"candidate_limit\": 50, \"genes_selected\": 2, \"max_feature_rows_per_gene\": 40, \"max_visible_bytes\": 30000, \"require_multisegment_cds\": true, \"same_source_pairs\": true, \"selection_order\": \"source GFF order; first two individually closed, connected eligible coding blocks within byte limit\"}, \"source_receipt_sha256\": \"844ad8410dbfb51ec12f770edadbec5074bf8a27ed40683dc636cd6e399227fe\", \"transform\": {\"after\": \"gene-LOC110818752_1\", \"attribute\": \"Parent\", \"before\": \"gene-LOC110818752\", \"policy\": \"one mRNA edge; other rows unchanged\"}}","sha256":"9dbb2d2bd531d014f3e456e2f229d1a6516a980fff3f8445634ce6efd752f8c0","source_group":"GCF_054855325.1","source_origin":"/home/Lianjunyang/临时/GCF_054855325.1_ASM5485532v1_protein.faa.gz"}],"source_group":"GCF_054855325.1","split":"sealed_test","stage":"structural_annotation","synthetic":true,"type":"fault","verbatim_tool_exceptions":[],"visible_contract":{"allowed_id_mapping":"仅精确匹配，不使用Name或CDS ID替代","artifact_roles":{"delivery":["artifacts/models.gff3","artifacts/proteins.faa","artifacts/record_counts.json"],"reference":[]},"consumer_contract":"完整Parent层级、同seqid/链、闭区间包含及CDS protein_id与FAA首token精确一一相接；允许partial与多片段","review_target":"input","scope":"declared_subset","usable_previous_result":false}}
