{"case_id":"t3_002","excerpt_policy":"两个原始完整编码gene块、所有子记录及关联完整FAA；闭包/连接参考核算后选样。格式子集标synthetic，不声称重跑原注释。","guidance_exposure":"unassigned","guidance_version_sha256":null,"injection_script":"bench/inspect_adapter/t3_packets.py","mechanism_family":"protein_identifier_connection","pair_id":"T3P1","pitfall_exposure":"held_out","pitfall_ids":[],"pressure_parent":null,"review_status":"draft","schema_version":"v3-spec-draft-1","seed":0,"source_files":[{"path":"sources/GCF_036370985.1_Kaz3_genomic.gff.gz","selection":"{\"gene_ids\": [\"gene-PWA37_002289\", \"gene-PWA37_003960\"], \"policy\": {\"answer_status\": \"draft\", \"api_calls\": 0, \"candidate_limit\": 50, \"genes_selected\": 2, \"max_feature_rows_per_gene\": 40, \"max_visible_bytes\": 30000, \"require_multisegment_cds\": true, \"same_source_pairs\": true, \"selection_order\": \"source GFF order; first two individually closed, connected eligible coding blocks within byte limit\"}, \"source_receipt_sha256\": \"844ad8410dbfb51ec12f770edadbec5074bf8a27ed40683dc636cd6e399227fe\", \"transform\": {\"after\": \"XP_064717966.101\", \"attribute\": \"protein_id\", \"before\": \"XP_064717966.1\", \"policy\": \"all segments of one CDS; no other field changes\"}}","sha256":"7fe0e77c8756d447ecb8dcac21b26c99632a00641ad940468bdc545dbe138085","source_group":"GCF_036370985.1","source_origin":"/home/Lianjunyang/临时/GCF_036370985.1_Kaz3_genomic.gff.gz"},{"path":"sources/GCF_036370985.1_Kaz3_protein.faa.gz","selection":"{\"gene_ids\": [\"gene-PWA37_002289\", \"gene-PWA37_003960\"], \"policy\": {\"answer_status\": \"draft\", \"api_calls\": 0, \"candidate_limit\": 50, \"genes_selected\": 2, \"max_feature_rows_per_gene\": 40, \"max_visible_bytes\": 30000, \"require_multisegment_cds\": true, \"same_source_pairs\": true, \"selection_order\": \"source GFF order; first two individually closed, connected eligible coding blocks within byte limit\"}, \"source_receipt_sha256\": \"844ad8410dbfb51ec12f770edadbec5074bf8a27ed40683dc636cd6e399227fe\", \"transform\": {\"after\": \"XP_064717966.101\", \"attribute\": \"protein_id\", \"before\": \"XP_064717966.1\", \"policy\": \"all segments of one CDS; no other field changes\"}}","sha256":"a7a018b8e3903fa1295cd8c2aa56305b3da9e9a7c8dd9624c7751428cd40bdf2","source_group":"GCF_036370985.1","source_origin":"/home/Lianjunyang/临时/GCF_036370985.1_Kaz3_protein.faa.gz"}],"source_group":"GCF_036370985.1","split":"sealed_test","stage":"structural_annotation","synthetic":true,"type":"fault","verbatim_tool_exceptions":[],"visible_contract":{"allowed_id_mapping":"仅精确匹配，不使用Name或CDS ID替代","artifact_roles":{"delivery":["artifacts/models.gff3","artifacts/proteins.faa","artifacts/record_counts.json"],"reference":[]},"consumer_contract":"完整Parent层级、同seqid/链、闭区间包含及CDS protein_id与FAA首token精确一一相接；允许partial与多片段","review_target":"input","scope":"declared_subset","usable_previous_result":false}}
